{
  "metadata": {
    "project_name": "Auth-System-Redesign",
    "overview": "Migrate legacy session-based authentication to modern JWT system with role-based access control. Implementation includes TypeScript type safety, Supabase integration, database schema updates, and comprehensive testing suite. Project addresses security vulnerabilities in current system and enables multi-tenant account management.",
    "technology_stack": [
      "TypeScript 5.3",
      "Next.js 14",
      "Supabase Auth v2",
      "PostgreSQL 16",
      "React 19",
      "Jest",
      "Playwright"
    ],
    "estimated_duration": "3-4 weeks"
  },
  "tasks": [
    {
      "id": "1",
      "name": "Establish TypeScript type system for authentication domain",
      "status": "NOT_STARTED",
      "requirements": ["FR-009", "NFR-004", "NFR-006"],
      "execution_type": "sequential",
      "execution_metadata": {
        "depends_on": [],
        "blocks": ["2", "3", "4"],
        "resource_locks": [
          "types/auth.ts",
          "types/database.ts"
        ],
        "parallelizable_with": []
      },
      "subtasks": [
        {
          "id": "1.1",
          "name": "Define core authentication interfaces and types",
          "is_test": false,
          "requirements": ["FR-009", "NFR-004"],
          "actions": [
            "Create Account interface with uuid, name, subscription_tier, created_at, updated_at fields",
            "Create User interface with id, email, account_id, role, last_login, metadata fields",
            "Define MemberRole union type with 'owner', 'admin', 'member', 'viewer' values",
            "Define SubscriptionTier enum with 'free', 'pro', 'enterprise' values",
            "Add JSDoc comments explaining Account-User relationship and role hierarchy"
          ],
          "status": "NOT_STARTED",
          "estimated_hours": 3
        },
        {
          "id": "1.2",
          "name": "Create JWT claim and session type definitions",
          "is_test": false,
          "requirements": ["FR-004", "FR-005"],
          "actions": [
            "Define JWTClaims interface with sub, email, account_uuid, role, exp fields",
            "Create SessionContext type for application-wide auth state",
            "Define AuthError discriminated union for type-safe error handling",
            "Add utility type guards for runtime JWT validation"
          ],
          "status": "NOT_STARTED",
          "estimated_hours": 2
        },
        {
          "id": "1.3",
          "name": "Write comprehensive type definition tests",
          "is_test": true,
          "requirements": ["NFR-006"],
          "actions": [
            "Test TypeScript compiler accepts valid type combinations",
            "Verify type guards correctly narrow discriminated unions",
            "Test type inference for utility functions with complex generics",
            "Validate JSDoc examples compile without errors"
          ],
          "status": "NOT_STARTED",
          "estimated_hours": 2
        }
      ]
    },
    {
      "id": "2",
      "name": "Implement JWT extraction and validation utilities",
      "status": "NOT_STARTED",
      "requirements": ["FR-004", "FR-005", "NFR-002", "NFR-007"],
      "execution_type": "sequential",
      "execution_metadata": {
        "depends_on": ["1"],
        "blocks": ["4", "5"],
        "resource_locks": [
          "lib/auth/jwt.ts",
          "lib/auth/validation.ts"
        ],
        "parallelizable_with": ["3"]
      },
      "subtasks": [
        {
          "id": "2.1",
          "name": "Create extractAccountUuid utility with fallback logic",
          "is_test": false,
          "requirements": ["FR-004"],
          "actions": [
            "Implement primary extraction from session.user.app_metadata.account_uuid",
            "Add fallback to user_metadata.account_uuid with warning log",
            "Add secondary fallback to database lookup by user.id with error log",
            "Return null and log critical error if all extraction methods fail"
          ],
          "status": "NOT_STARTED",
          "estimated_hours": 4
        },
        {
          "id": "2.2",
          "name": "Build JWT validation and refresh token handler",
          "is_test": false,
          "requirements": ["FR-005", "NFR-002", "NFR-007"],
          "actions": [
            "Implement validateJWT function checking signature, expiration, and required claims",
            "Create refreshToken function with automatic retry on network failure",
            "Add token rotation logic preventing replay attacks",
            "Implement secure token storage with httpOnly cookies"
          ],
          "status": "NOT_STARTED",
          "estimated_hours": 6
        },
        {
          "id": "2.3",
          "name": "Test JWT utilities across edge cases",
          "is_test": true,
          "requirements": ["NFR-007"],
          "actions": [
            "Test extractAccountUuid handles missing account_uuid gracefully",
            "Test validateJWT rejects expired tokens and invalid signatures",
            "Test refreshToken handles 401 responses correctly with token rotation",
            "Test concurrent token refresh requests don't cause race conditions",
            "Verify secure cookie flags set correctly (httpOnly, secure, sameSite)"
          ],
          "status": "NOT_STARTED",
          "estimated_hours": 5
        }
      ]
    },
    {
      "id": "3",
      "name": "Design and implement PostgreSQL database schema",
      "status": "NOT_STARTED",
      "requirements": ["FR-008", "FR-009", "FR-010", "NFR-005"],
      "execution_type": "sequential",
      "execution_metadata": {
        "depends_on": ["1"],
        "blocks": ["4", "6"],
        "resource_locks": [
          "database/schema.sql",
          "database/migrations/*",
          "database/seeds/*"
        ],
        "parallelizable_with": ["2"]
      },
      "subtasks": [
        {
          "id": "3.1",
          "name": "Create normalized multi-tenant database schema",
          "is_test": false,
          "requirements": ["FR-008", "FR-009"],
          "actions": [
            "Create accounts table with uuid primary key, name, subscription_tier, created_at, updated_at",
            "Create users table with id, email (unique), account_id (foreign key), role, last_login, metadata jsonb",
            "Create user_sessions table for tracking active sessions with user_id, token_hash, expires_at",
            "Define composite indexes on (account_id, role) and (email) for query optimization",
            "Add check constraints ensuring subscription_tier and role values are valid"
          ],
          "status": "NOT_STARTED",
          "estimated_hours": 4
        },
        {
          "id": "3.2",
          "name": "Implement zero-downtime migration framework",
          "is_test": false,
          "requirements": ["NFR-005"],
          "actions": [
            "Configure node-pg-migrate with PostgreSQL connection pooling",
            "Create initial migration file creating schema from 3.1",
            "Add schema_migrations table tracking applied migrations with timestamp and checksum",
            "Implement rollback script with data preservation for emergency reversion",
            "Create migration testing script validating up/down migrations in transaction"
          ],
          "status": "NOT_STARTED",
          "estimated_hours": 5
        },
        {
          "id": "3.3",
          "name": "Generate seed data for development and testing",
          "is_test": false,
          "requirements": ["FR-010"],
          "actions": [
            "Create seed script generating 3 test accounts with different subscription tiers",
            "Generate 10 users across accounts with varied roles (owner, admin, member)",
            "Add seed data for edge cases (expired sessions, users without accounts)",
            "Implement seed data cleanup script for test database reset"
          ],
          "status": "NOT_STARTED",
          "estimated_hours": 3
        },
        {
          "id": "3.4",
          "name": "Test migration system and data integrity",
          "is_test": true,
          "requirements": ["NFR-005"],
          "actions": [
            "Test forward migration creates all tables, indexes, and constraints correctly",
            "Test rollback migration cleanly removes all changes without orphaned data",
            "Verify migration idempotency by running same migration twice",
            "Test migration on empty database and database with existing legacy schema",
            "Validate foreign key constraints prevent orphaned records"
          ],
          "status": "NOT_STARTED",
          "estimated_hours": 4
        }
      ]
    },
    {
      "id": "4",
      "name": "Build Supabase authentication integration layer",
      "status": "NOT_STARTED",
      "requirements": ["FR-001", "FR-002", "FR-003", "NFR-001"],
      "execution_type": "sequential",
      "execution_metadata": {
        "depends_on": ["1", "2", "3"],
        "blocks": ["5", "6"],
        "resource_locks": [
          "lib/supabase/client.ts",
          "lib/supabase/auth.ts",
          "lib/supabase/middleware.ts"
        ],
        "parallelizable_with": []
      },
      "subtasks": [
        {
          "id": "4.1",
          "name": "Configure Supabase client with custom auth settings",
          "is_test": false,
          "requirements": ["FR-001", "NFR-001"],
          "actions": [
            "Initialize Supabase client with project URL and anon key from environment",
            "Configure auth persistence using localStorage with encryption for tokens",
            "Set custom token refresh interval to 45 minutes (75% of expiry)",
            "Add request interceptor injecting account_uuid into all authenticated requests"
          ],
          "status": "NOT_STARTED",
          "estimated_hours": 3
        },